<?xml version="1.0" encoding="UTF-8"?>

<!-- VERSION 4 - Ejemplo TSAT (Desconexion) -->

<mensaje
 xmlns:xsi="http://www.w3.org/2001/XMLSchema-instance"
 xsi:noNamespaceSchemaLocation="mensajeGeneral.xsd">

	<!-- CABECERA -->
	<cabecera>
	
		<!-- Identificador del mensaje -->
		<idMensaje>1234</idMensaje>
		
		<!-- Identificador del emisor (dividido en IP e ID) -->
		<identificacionEmisor>
			<ipEmisor>192.168.0.1</ipEmisor>
			<idEmisor>1</idEmisor>
		</identificacionEmisor>
		
		<!-- Identificador del receptor (dividido en IP e ID) -->
		<identificacionReceptor>
			<ipReceptor>192.168.0.1</ipReceptor>
			<idReceptor>1</idReceptor>
		</identificacionReceptor>
		
		<!-- Tipo del mensaje -->
		<tipoMensaje>TSAT</tipoMensaje>
		
		<!-- Fecha del mensaje -->
		<fecha>2019-09-24</fecha>
		
		<!-- Hora de envio -->
		<horaEnvio>11:00:00</horaEnvio>
		
		<!-- Hora de recepción -->
		<horaRecepcion>11:00:01</horaRecepcion>
		
	</cabecera>
	
	<!-- CUERPO -->
	<!-- NOTA: Importante xsi:type para indicar el tipo de cuerpo que espera. -->
	<!-- En desconexion se incluye de nuevo una lista de tiendas conocidas, únicamente por reutilizar el tipo TSAT
	      Se ha considerado obligar a incluir listaTiendas (en vez de hacerlo opcional) porque es más importante asegurar que en la conexión
	      se incluye la información necesaria que poder no poner nada en la desconexión y permitir errores durante la conexón (que no se incluya la lista -->
	<cuerpo xsi:type="tipoTSAT">
    <protocolo>DESCONEXION</protocolo>
    <listaTiendas>
      <tienda>
        <ip>63.33.189.149</ip>
        <id>1</id>
      </tienda>
      <tienda>
        <ip>63.33.189.149</ip>
        <id>2</id>
      </tienda>
    </listaTiendas>
	</cuerpo>
	
</mensaje>
